{
    "$schema": "https://json-schema.org/draft/2020-12/schema",
    "description": "Schema for bitbake-setup configuration files",
    "type": "object",
    "required": [
        "description",
        "bitbake-setup",
        "version"
    ],
    "properties": {
        "description": {
            "type": "string",
            "description": "Description of the bitbake-setup configuration file"
        },
        "sources": {
            "$ref": "layers.schema.json#/properties/sources"
        },
        "bitbake-setup": {
            "type": "object",
            "description": "BitBake-setup configurations",
            "required": [
                "configurations"
            ],
            "properties": {
                "configurations": {
                    "type": "array",
                    "minItems": 1,
                    "$anchor": "configurations",
                    "items": {
                        "type": "object",
                        "properties": {
                            "name": {
                                "type": "string",
                                "description": "Name of the configuration"
                            },
                            "description": {
                                "type": "string",
                                "description": "Human-readable description of the configuration"
                            },
                            "bb-layers": {
                                "type": "array",
                                "description": "List of BitBake layers to include",
                                "items": {
                                    "type": "string"
                                }
                            },
                            "oe-template": {
                                "type": "string",
                                "description": "OE-template configuration"
                            },
                            "oe-fragments": {
                                "$anchor": "oe-fragments",
                                "type": "array",
                                "description": "List of BitBake configuration fragments to enable",
                                "items": {
                                    "type": "string"
                                }
                            },
                            "oe-fragments-one-of": {
                                "type": "object",
                                "description": "Mutually exclusive bitbake configuration fragment",
                                "patternProperties": {
                                    ".*": {
                                        "type": "object",
                                        "required": [
                                            "description",
                                            "options"
                                        ],
                                        "properties": {
                                            "description": {
                                                "type": "string",
                                                "description": "Human-readable description of the fragment category"
                                            },
                                            "options": {
                                                "$ref": "#oe-fragments"
                                            }
                                        },
                                        "additionalProperties": false
                                    }
                                },
                                "additionalProperties": false
                            },
                            "configurations": {
                                "$ref": "#configurations"
                            },
                            "bb-env-passthrough-additions": {
                                "type": "array",
                                "description": "List of environment variables to include in BB_ENV_PASSTHROUGH_ADDITIONS",
                                "items": {
                                    "type": "string"
                                }
                            }
                        },
                        "additionalProperties": false
                    }
                }
            },
            "additionalProperties": false
        },
        "version": {
            "description": "The version of this document; currently '1.0'",
            "enum": [
                "1.0"
            ]
        }
    },
    "additionalProperties": false
}
